,Date de publication,Ville,Avis,Score,Type
559,2018-05-23,Paris,au je nai mme pas attendu min rapidement pris en charge et jai reu de trs bon conseils sur mes projets davenir,0.5620914399623871,Positif
560,2020-05-22,Paris,vous arrivez mme inventer des faux emplois mais prcaire au final mais pour des entreprises fric entre les banques optimisation votre btp il plus rien de bon,0.8590337634086609,Negatif
561,2021-05-22,Paris,fuire la conseillre va tout faire pour vous dcourager et vous caser dans un mtier que vous naimez pas,0.698875904083252,Negatif
562,2017-05-23,Paris,quil ya des gens pour te renseigner mes pas beaucoup de temp taccorder et le matriel dont les ordi sont trs acessible,0.4354538321495056,Neutre
563,2022-08-25,Paris,agents attentifs bon accueil,0.8732483088970184,Positif
564,2020-05-22,Paris,cest immonde,0.9626016318798065,Negatif
565,2017-05-23,Paris,trop du monde,0.6918025314807892,Negatif
566,2019-05-23,Paris,atil un travail je nai pas trouv de travail en turquie tentons notre chance ici,0.568795770406723,Positif
567,2023-01-22,Taverny,bonjour une excellente anne je tiens remercier veronique loy et joel morin pour leur travail sur mon dossier en effet jai pu obtenir une formation au cap cuisine avec le module cration dentreprise et reconversion activ cra et activ projet lquipe est disponible et ractive ne baissez pas les bras tout est possible et encore plus pour cette anne,0.9901390001177788,Positif
568,2022-08-25,Taverny,prise de rendezvous impossible la plateforme conseiller qui ne suit pas vos mails et vous traite de menteur quand vous les appelez pour leurs notifier et qui raccrochent au nez quand vous essayer dexpliquer votre situationmerci de faire le ncessaire pour amliorer vos services,0.9621906504034996,Negatif
569,2022-05-22,Taverny,bonjouril est impossible de pouvoir sinscrire sur ple emploi et ce depuis plusieurs jours voir semaine cest vraiment navrant car cela va mobliger passer lagence il serait bien que vous puissiez faire quelque chose sur votre appli qui fonctionne trs mal,0.9655057191848755,Negatif
570,2021-05-22,Taverny,je demande pourquoi les conseillers ont choisi ce travail si ils nont pas envie daider les gens je rencontrai un problme au niveau de mon inscription et au bout de semaines toujours pas rgl jenvoi donc un mail conseillre dont je taierais son nom pour avoir de laide et elle rpond je fais pas les inscription moi daccord donc je fais comment etant donn que je nai pas didentifiant et que personne ne fais rien pour maider et le gros lot ce jour ou je lui demande un rdv pour une cration dentreprise et elle rpond les rdv se prennent par tlphone merciok donc clairement elle sert quoi jai hate de la rencontrer dites donc,0.859116792678833,Negatif
571,2022-05-22,Taverny,mesure dhygine respecter par le personnel qui est trs agrableil serais bien que les demandeur demploi soit plus aimable avec le personnel qui bien du courage de rester zenmerci nomie pour son aide sa gentillesse et sont aimabilitbon courage et merci toute lquipe,0.8155089318752289,Positif
572,2020-05-22,Taverny,agence agrable avec un bon accueil des conseillers performants qui rpondent rapidement mes demandes un grand merci monsieur pierron william qui fait preuve dune grande implication et dun rel sens de la relation humaine merci lquipe de taverny,0.9638990163803101,Positif
573,2020-05-22,Taverny,une agence qui ne correspond pas aux clichs que lon se fait de ple emploije souligne la prsence de conseillers attentifs ractifs et conscientieux permettant une efficacit remarquable,0.5718994289636612,Positif
574,2020-05-22,Taverny,lamabilit de la personne laccueil du juin pres midi est mettre la poubelle heureusement que dautre sont audessus de sont niveau vous avez besoin dun renseignement adress vous personne cest mieux en cinquante ans aucun service digne de ce nom,0.9809397980570793,Negatif
575,2019-05-23,Taverny,je suis surprise de lire des manifestations ngatives de cette agence licencie abs il pris le temps de rassurer et donner routes les informations dont javais besoin ils font preuve dhumanisme merci pour leur professionnalisme,0.9246675968170166,Positif
576,2022-05-22,Taverny,laccueil et la ractivit des quipes sont de trs bonnes qualitsnotamment mm noemiemerci pour les services rendus et la comprhension des diffrents problmes,0.9171452224254608,Positif
577,2019-05-23,Taverny,cest le pire des ple emploi tous avec le sourire tous bien habill mais quand il sagit de leurs comptences reste revoir ils ont une aisance leur poste qui fait qui vous rponde avec arrogance et beaucoup de va voir ailleurs si jy suis croire quils ont limmunit chez ple emploi sur ce je vais marrter l car il trop de choses dire,0.8829742968082428,Negatif
578,2020-05-22,Taverny,la dame un certain ge l acceuil n est vraiment pas aimable et dirai qu la drange quand lui demande un conseilparcontre un jeune garon qui occupe des ordinateurs en salle nous aide et de trs bonne volontc est le paradoxe,0.4669806733727455,Negatif
579,2020-05-22,Taverny,pour avoir souvent lagence de ple emploi taverny je peux affirm que le personnel est impliqu et nous accompagne jusquau bout de nos dmarche,0.9056325256824493,Positif
580,2018-05-23,Taverny,le pire pole emploi de tout les dpartements ils refusent de donner les allocations et une semaine aprs ils mont donner rdv je croyais quils mont trouver un travail mais non ctait pour mannoncer que jai un trop peru de,0.9502682685852051,Negatif
581,2020-05-22,Taverny,un grand merci pour samuell entretien tlphonique un accueil chaleureux et de bcp aide pour moi ainsi qu la direction du ple emploi taverny,0.9559155404567719,Positif
582,2020-05-22,Taverny,une conseillre au veronique loy elle aid comme aucun conseiller ne la fait jusqu prsent il en faudrait plus comme elle,0.7120984792709351,Positif
583,2022-05-22,Taverny,merci lquipe qui est trs agrable et efficace de laccueil au conseiller,0.9265087246894836,Positif
584,2018-05-23,Taverny,une bonne agence une conseillre au rien na ajouter,0.8448814153671265,Positif
585,2019-05-23,Taverny,leur numro pas bon comment peut les joindre cest nimporte quoi,0.9291921705007553,Negatif
586,2019-05-23,Taverny,acceuil moyen et services qui laissent dsirer,0.55241858959198,Neutre
587,2018-05-23,Taverny,une agence au des conseillers ractifs merci,0.7927968502044678,Positif
588,2019-05-23,Taverny,un pole emploi viter tout prix,0.7556199282407761,Negatif
589,2018-05-23,Taverny,du vrai foutage de gueule,0.5628713667392731,Negatif
590,2022-11-23,Paris,la prise en charge est plus que dplorable des conseillers qui ncoutent absolument pas les gens quils suivent rponses presque robotiques aux mails considration pour les profils jeunes ans qui en veulent et qui dsirent sen sortir dirait presque quils prennent plaisir mettre des btons dans les roues de ceux qui ne veulent pas finir leur vie conseiller ple emploi fuir au maximum les employs sont si incomptents quon se demande comment ils sont embauchs au hasard,0.5325238555669785,Negatif
591,2022-11-23,Paris,ils sont irrespectueux se foutent de votre gueule et des gros menteurs fait mois quils disent quils vont rgler le problme jattend toujours des personnes incomptencesje dois faire leur travail leur place une autre agence ple emploi tait assez surprise que je les appelle la place de ses collgues du rue piat,0.9201266914606094,Negatif
592,2021-05-22,Paris,je suis inscrite cette agence j ai eu auparavant conseillers trs l coute trs humains et bienveillants et depuis quelques temps cest une autre conseillre avec qui la communication ne passe pas du tout elle est trs dsagrable agressive et n est pas du tout lcoute comment faire pour demander changer de conseillere merci davance,0.5895295739173889,Negatif
593,2019-05-23,Paris,jai eu faire conseills diffrents dans cette agence super lcoute gentils et qui mont bien tout expliqu et trs bien conseills dont conseillre actuelle et horrible sur la dfensive malaimable ltoile en moins,0.7701624929904938,Positif
594,2018-05-23,Paris,affreuxle pire ple emploi de parisprenez un ticket revenez demain panne informatique au guichet daccueilmme la caf ou au impts est mieux accueilli,0.9425120502710342,Negatif
595,2022-05-22,Paris,bonjourje voudrais signaler que jai trs bien accueillie ce matin dans cette agence merci,0.7871701419353485,Positif
596,2017-05-23,Paris,aucune piti sang froid pas de solidarit pense que dargent,0.8868981003761292,Negatif
597,2017-05-23,Paris,le numro de tlphone est erronmerci de le rectifier vers le,0.4991302192211151,Negatif
598,2019-05-23,Paris,agrable,0.8038827776908875,Positif
599,2022-09-24,Clichy,de trs mauvaises expriences avec le centre ple emploi de clichy de nombreuses informations manquantes chaque conseiller sa manire de procder et donc mon dossier se retrouve bloqu chaque tape des indemnits quil faut supplier pour pouvoir les toucher avec plusieurs semaines de retard jai un statut dautoentrepreneur mais en fait il vaut mieux ne pas travailler sinon les dmarches deviennent compliqus et mme les conseillers sy perdent,0.9460596144199371,Negatif
600,2022-05-22,Clichy,pole emploi dans lensemble bien entretenue un conseiler votre coute mais avec les nouvelles dmarches et les rformes operer ont ce rapproche plus dun tablissement rentabiliserlors de mon entretien mavertit avant toute choses que refus de travailsindmnisations sautok pour une er impression quasi froideen bref jai trouver du taff rapidement mais surement pas grace eux et encore moins avec leurs offres demploi sur site,0.4499816298484802,Neutre
601,2020-05-22,Clichy,quipe incomptente vit de tout prix quitte faire minutes de transport pour ce diriger vers un autre je vous le conseille trs fortement il mois je suis pole emploi pour premire demande dallocation chmage car je nai seulement ans et tout ce qui est administratif je ni connait rientrs bien accueilli propose de soccuper de mon dossier mois plus tard apres mail envoy avec des reponse positif comme quoi lon soccuper de mon dossier il fallais attendreaujourdhui je dirige vers cette fameuse agence rsultatje suis radi et dsinscrit ils se sont occuper de rien du tout est jamais mieux servi que par sois mme dsormais je vais men occuper solodommage que lon ne puisse pas mettre toiles,0.681214451789856,Positif
602,2017-05-23,Clichy,que restetil dire de ple emploi rien clique ceux qui peroivent des allocations chmage et pour les autres passez votre chemin les chmeurs ne sont l que pour leur donner du travail cest limpression dsagrable avec laquelle en ressort,0.93110691010952,Negatif
603,2022-05-22,Clichy,une toile cest beaucoup jai eu une femme excrable au tlphone qui ne sait pas faire son travail correctementcette dame hurl dessus puis raccrocher au nez manque de professionnalisme total pour qui ce prend telle cest inadmissible davoir faire des personnes comme cest scandaleux fuir,0.9771595299243927,Negatif
604,2018-05-23,Clichy,les agents de ple emploi se croient plus suprieur que les demandeurs demploi pas pro du tout et trs compliquer de demander une formation ou contrat pro parce que il faut insister soit disant peut tre refuse vive la france comme mme,0.6164515167474747,Negatif
605,2022-05-22,Clichy,vous regarde de hautte fait sentir misrables car demandeur emplois pas souriant parle fort comme si tu tais un demeurer j aime pas l impression qui se donne aucune motivation tu es un numro et c est tout,0.7427555918693542,Negatif
606,2019-05-23,Clichy,mois que jhabite clichy pas de numero joinable cest inadmissible jai envoyer milles mails conseillere sans aucun retour de rponse obliger de se deplacer la bas pour prendre rdv et beh lattends toujours le rdv pffff aucun professionnalisme,0.988426074385643,Negatif
607,2018-05-23,Clichy,personnel nul ne connat pas son travail se demande si les conseillers ne sont embauch en emploi fictif,0.9058302789926529,Negatif
608,2017-05-23,Clichy,personnel incomptent que vous soyer demande de emploi ou employeur,0.49896541237831116,Negatif
609,2022-10-24,Clichy,toujours pareil,0.517624095082283,Positif
610,2017-05-23,Clichy,accueil chaleureux et responsable disponibilit des agents et conseillers,0.9100649654865265,Positif
611,2018-05-23,Clichy,personnel accueillant et disponible,0.8572142124176025,Positif
612,2018-05-23,Clichy,super agence,0.9533385336399078,Positif
613,2018-05-23,Clichy,clichy la garenne,0.5275955051183701,Positif
614,2022-05-22,Clichy,somnolent,0.9371337741613388,Negatif
615,2018-05-23,Clichy,nullllll,0.950062595307827,Negatif
616,2017-05-23,Clichy,rapidit de service,0.4217420965433121,Positif
617,2018-05-23,Clichy,bon conseiller,0.8650836050510406,Positif
618,2023-04-22,Asnières-sur-Seine,alors je suis trs mcontent de monsieur taoufik harouach il ne respect lengagement dune rponse dans un dlai de h dans un premiers temps dans un second temps il ne rpond jamais et de plus clture les conversation aprs mail pour lui expliquer situation il ne comprend pas alors que je lui explique de manire claire et simple vraiment je suis mcontent et fais un moment que dure,0.8684073984622955,Negatif
619,2022-11-23,Asnières-sur-Seine,calcul dindemnits totalement faux te demande de rembourser tes indemnits alors quils ont mme pas fait bien le calcul sur la priode et ils ont oubli une autre priode arnaque totale,0.9922428466379642,Negatif
620,2022-11-23,Asnières-sur-Seine,le personnel est trs professionnel et lcoute ils vous donnent toutes les informations dont vous aurez besoin,0.9310081303119659,Positif
621,2023-04-22,Asnières-sur-Seine,trs mauvais calcul des indemnits et ils demandent de rembourser les indemnits toucher et refuse de calculer les nouvelles indemnits,0.9520932585000992,Negatif
622,2021-05-22,Asnières-sur-Seine,donne rdv pour nous faire perdre notre temps incomptent et incapable de traiter une inscription depuis semaines contacte aujourdhui pour signaler quil un dysfonctionnement technique avec mon inscription impossible recontacter par mail car il sest pass trop de temps depuis dernire requte,0.9230659902095795,Negatif
623,2022-07-26,Asnières-sur-Seine,je mets les toiles car le personnel est trs lcoute conseillre suit de trs prs elle ne lche pas vraiment le meilleur ple emploi,0.6259332448244095,Positif
624,2020-05-22,Asnières-sur-Seine,je vais vous partager mon avis en toute honntet premirement le fait que se soit ferm laprs midi est un gros problme qui bloque de nombreuses personnes les conseillers incomptents je ne dis pas tous mais la personne qui suit lest dj dans les comptes rendus suite un entretien ne se reconnat pas mensonge sur mensonge ce nest mme pas nos mots nos propos sont dforms pour nous faire passer pour des personnes incapables ne voulant pas travailler honteux et choquant besoin dtre form afin daquerir de lexprience pour un travail stable et sur non ils nous font tourner en rond perte de temps et inutile pour,0.9665782749652863,Negatif
625,2022-05-22,Asnières-sur-Seine,quel honte cette agence,0.9828530326485634,Negatif
626,2022-06-26,Asnières-sur-Seine,,0.49993762373924255,Positif
627,2023-04-22,Ermont,il arrte pas de changer de conseill ils met les rdv sans nous demander en plus tu rponds leur convocation mais eu comme par hasard ils oublient de te mettre prsent pourtant javais bien sign et tappelle une deuxime fois la mme convocationcest nimporte quoi,0.951419323682785,Negatif
628,2023-02-21,Ermont,entretien tlphonique de min jai la nette impression davoir une employe de hotline au bout du fil rponses toutes faites avec tournures de phrases alambiques histoire de prouver sa supriorit coupe la parole javais une liste de question poser jai russi en poser une en forant madame fait un cours magistral sur la faon de se servir de loutil de recherche de formation je ne suis pas quand mme pas une epeutnrt oui ce mot existe et si vous estimez quon vous manque de respect et que cela vous est dsagrable imaginez ce que cela fait quand vous ne mavez mme pas accord votre consideration,0.8693679869174957,Negatif
629,2021-05-22,Ermont,bonjourje suis passer ce jour dposer un document laccueil une jeune demoiselle coupe carr blonde pas trs avenante et agrable franchement elle mriterait bien un zro toile et de ne pas la mettre laccueil ni en contact avec les demandeur demploi cest dj pas vident pour les personnes qui ne travaillent pas mais en plus davoir laccueil ce genre de personne ben bonjour la journe dieu merci les autres collgues trs agrables souriantes et mme derrire un masque le voit ce sourire et pour finir jai appeler pour avoir un renseignement et la personne au bout du fil qui fait du tltravail pareil trs agrable souriante et rassurante donc voil pour petite exprience et merci pour leur sourire et coute,0.42090973258018494,Negatif
630,2022-05-22,Ermont,des incomptents autrement ce nest pas possiblejai envoy un mail et toujours pas rponse une semaine plus tard je renvoie un mail mais toujours loreille sourde croire quon fait la manche alors quon cotis pour abref gerber ces gens,0.9857946783304214,Negatif
631,2021-05-22,Ermont,contrairement aux mauvais avis que vous pouvez lire sur cet tablissement mon exprience personnelle plutt bonne jusque lle personnel toujours su se montrer comptent et rpondre aux questions que javais pu avoir et je nai jamais eu de problmes avec mes indemnisations ou autresimplement la ractivit pourrait tre amliore le reste je nai aucune plainte effectuer,0.8757966756820679,Positif
632,2018-05-23,Ermont,le personnel est trs lcoute et professionnel lorsque lon sollicite son aidecontrairement dautres agences celleci ne donne pas trop le cafard et vous avez de la place pour patienter tranquillementseule mauvaise exprience jai reu un avertissement de radiation pour absence mon premier entretien professionnel sauf que je navais jamais reu aucune convocation lerreur rpare le systme informatique tant coupable en ayant automatis la procdure par erreur,0.4606977105140686,Negatif
633,2019-05-23,Ermont,trs incomptent naide pas aux recherches demploi sont irrespectueux envers vous impose les dates de rendezvous sans demander les disponibilits la personne avant ce qui fait que si annule cause dun ou plusieurs rendezvous mdicaux ils se permettent de nous dire quon avait cas sinscrire aprs nos rendezvous nos problmes certaines de leurs offres sont des arnaques je dconseille fortement cest une honte,0.9933817107230425,Negatif
634,2021-05-22,Ermont,mon commentaire concerne le service pole emploi ralli au dpartement du val doise jai voulu appeler pour quelques renseignements concernant situation jai choque de lattitude de la personne que jai eu au bout du fil haussant le ton pour dire ne commencez pas remettre parole en doute parce que va mal aller je nai pas vraiment eu le temps de lui expliquer le problme elle coupait la parole sans arrt et fini par raccrocher au nez pendant que je parlaisje ne suis mme pas encore inscrite ple emploi et commence dja trs mal,0.8314598798751831,Negatif
635,2015-05-24,Ermont,proche de la gare et plac ct dune clinique les places pour se garer sont aussi rares que chresil toujours affluence faute la conjoncture et depuis plus de dix ansnessayez pas le tlphone celuici est toujours occuple personnel semble toujours dbord et manque de ce fait damabiliton limpression de dranger et le manque de considration notre gard pousse demander sils ont conscience que cest grce aux sans emplois quils ont euxmmes un emploicest malheureusement le parcours obligatoire entre deux emplois,0.6729441583156586,Negatif
636,2019-05-23,Ermont,incomptence totale ne rponds pas leur mail ne nous aide pas dans nos recherches demploi par tlphone cest encore pire entre minutes dattente pour entendre il faut voir avec votre conseillre mais conseillre rponds quand elle veut c est dire jamais cest cause dun ple emploi comme celui la quil autant de chmeurs,0.9811875745654106,Negatif
637,2023-02-21,Ermont,une administration de qualitpersonnel comptent et agrable,0.8171141743659973,Positif
638,2021-05-22,Ermont,personnel aggresif et incomptent au tlphone mauvaise gestion sur place la dame de laccueil va jusqu menacer de minscrire des formations intensives si je ne suis pas satisfait,0.7404662370681763,Negatif
639,2022-05-22,Ermont,si je ne pouvais mettre aucune toile je le ferais sans hsiter jai envoy un mail ne jamais rpondu je renvoie le mme mail jours aprs en prcisant que je suis insatisfaite jattend toujours une rponse incapable de rpondre des mails la moindre des choses et de rpondre au gens vue le temps quil passent discuter ils ont du temps de libre et si annule un rendez vous ou si ne peu pas aller il nous menace de nous radier inadmissible vraiment sa ne vos pas plus quune toile,0.9911037236452103,Negatif
640,2022-05-22,Ermont,personnel payer grassement avec vos impts travail rellement heures par semaine contrat heures heures par jours et encore je suis gnreux vive la fonction publique ne pas oublier les fermetures exceptionnelles dans lanne le vendredi le hasard si si,0.5647397488355637,Negatif
641,2016-05-23,Ermont,il serait peuttre temps dindiquer la bonne adresse qui apparait en gros lorsquon la demande sur google cela fait un bon nombre dannes que ce nest plus rue de stalingradpour ce qui est de lagence actuelle jy suis alle fois et fois bien accueilli rapide efficace aimable sans chichi,0.7787444889545441,Positif
642,2018-05-23,Ermont,accueil excrable il semble que ce nest pas parce que lon est demandeur demploi que lon est un moins que rienen plus de faire une faute chaque mot ils sont de leur propre aveu btes et procduriersque dire de plus,0.7427525222301483,Negatif
643,2019-05-23,Ermont,bonjourau vu de tous ses avis avec etoilece n est pas gagn je suis chef entreprise etpour notre nous recherchons un ecoiffeur se polyvalente motiv avec ans dexpriences aprs le brevet professionnelsecteur ermontstudio mng coiffuredemander ghilicordialement,0.7673861384391785,Positif
644,2017-05-23,Ermont,personnel dsagrable et incomptent vous tes oblig dy aller plusieurs fois car ils ne comprennent rien votre demande et il semble que ce soit fait exprs pour ralentir votre indemnisation,0.8962539881467819,Negatif
645,2021-05-22,Ermont,si je pouvais mettre toile je laurais mise employs incomptent qui ne transmet pas les informations au suprieur jai du appeler sur plusieurs jours lon mas mme raccrocher au nez car je voulais absolument parler un suprieur,0.888536274433136,Negatif
646,2020-05-22,Ermont,donnez pas des rdv au gens si cest pour les prendre h aprs que chacun vienne en candidat libre non mais quel est ce manque de respect,0.9012953191995621,Negatif
647,2021-05-22,Ermont,qd une conseillere pas comptenteon sait pourquoi il ya de personne sest immol devant ple emploi pour pouvoir exprimer,0.587513655424118,Negatif
648,2022-05-22,Ermont,excellent accueil des conseillers qui ont pris le temps de mcouter et dapporter une rponse efficace mon problme merci,0.9536771178245544,Positif
649,2018-05-23,Ermont,le ple emploi embauche des bons rien qui ne savent mme pas rpondre un mail ni passer un coup de tlphone pauvre france et dire que cest des gens incomptents qui sont censs nous retrouvs du travail,0.8647185564041138,Negatif
650,2017-05-23,Ermont,personnel inefficace lent et trs dsagrableconseiller ne rpondant jamais aux mailstlphone toujours occup,0.9274983555078506,Negatif
651,2019-05-23,Ermont,personnel dsagrable qui mprise et nous prends pour des idiots honte vous,0.9503345191478729,Negatif
652,2018-05-23,Ermont,pour le moment va mais jattends dtre reue je ne peut mavancer,0.42936065793037415,Neutre
653,2020-05-22,Ermont,bonne accueil trs bien dirige pour toute information rapide efficace,0.9367281496524811,Positif
654,2019-05-23,Ermont,impossible davoir un rdv cest vraiment incroyable,0.8235679939389229,Negatif
655,2022-11-23,Gennevilliers,en ils se sont amliors et tout le monde est aimable et aidant en commenant avec lagent de scurit en continuant avec les agents qui aident ceux et celles qui ont du mal avec les demarches dornavant faire en ligne et finissant avec une conseillre qui sinteresse dabord vous en tant que personne plutt qua une matricule,0.7688330113887787,Positif
656,2023-01-22,Gennevilliers,service nulle et incapable de donner un stage au bout de ans et demi pas de suivi il sont pays rien faire bonne planque bref ne rien attendre deux,0.9969435445964336,Negatif
657,2023-04-22,Gennevilliers,premier rdv et franchement tout le monde est bienveillant souriant et avec des bons conseils,0.9495628178119659,Positif
658,2022-06-26,Gennevilliers,franchement je lis des commentaires et je demande ce que les gens attendent de ple emploi formation indemnits assedic et cest tout arrtez den demander trop ce ne sont pas des magiciensct humain il de tout des incomptents ainsi que le contraire des gens trs qualifis et aimablesje ne met que deux toiles car lorsque jai eu un trop peru les agents de ple emploi gennevilliers ont trs rabaissant et agressifs envers moi comme ci ctait leur argent et comme ci jtais un voleur,0.8547966182231903,Negatif
659,2019-05-23,Gennevilliers,personnel aimable et poli en revanche ct pro zroun dossier formation poste restante il fallu se dplacer une enime fois pour que bouge bilan mois dattente pour un dossier complet ds le dbutcration dentreprise connaissance approximative des circuitsoblige de lire dans le marc de caf pour savoir quel document envoy pour continuer percevoir ses indemnits ple emploi ne vous informe pas il faut tre extralucide joindre un responsable pour formuler une rclamation pas possiblebilan pour retravailler il vaut mieux avoir une bonne dose de volont et de largent devant soi car ple emploi nest pas trs ractif nos problmes,0.5936576724052429,Negatif
660,2022-09-24,Gennevilliers,se ple emploi est tout simplementpourri et incomptentradiation pour aucun motifles conseils son incomptent et agressif,0.9780404716730118,Negatif
