,Date de publication,Ville,Avis,Score,Type
1104,2022-05-22,Nogent-sur-Marne,une exprience vraisemblablement au antipode des commentaires cicontre je suis rendue sur site pour la premire fois ce jour peu avant h jai reu rapidement aiguille et conseille par un professionnel lcoute comptent et trs humain cette personne pris le temps de revoir mon dossier dossier pour lequel une solution trouv les locaux sont neufs lendroit est ar et la salle dattente tait calmel accueil et lchange passs ont largement dpass mes esprancesconclusion un grand merci aux personnes qui mont aid de prs ou de loin dans dmarche,0.8026245534420013,Positif
1105,2022-10-24,Nogent-sur-Marne,le nant offres non cibl pourquoi je recevais des offres htmljavascriptweb je nai jamais un dveloppeur web et ne le serais jamaisjtais dveloppeur systme rseau en cje nai jamais fait de la glu au petit bonheur la chance avec du jsjanalysais les problmes cherchais des algorithme adapts aux problmes dernire application lignes de c pour crr des flipbook partir de pdfa doit expliquer pourquoi tous leurs messages arrivaient dans spamou est pass lanpe une autre poque contact trs fructueux offre demploi bien cibl dans mon domaine,0.5508585274219513,Positif
1106,2023-02-21,Nogent-sur-Marne,beaucoup dhumanit dans cette antenne lcoute de bonnes explications srieux et propositions cibles mention spciale houze,0.851465106010437,Positif
1107,2022-05-22,Nogent-sur-Marne,contact catastrophique avec la directrice de lagence et les conseillers aucune coute aucune courtoisie les personnes avec qui jai chang sur situation taient agressives et mont fait comprendre que je les drangeaisje ne comprends pas comment ils peuvent exercer ces responsabilits le jour et la nuit par rapport prcdente agence pole emploi,0.9672405272722244,Negatif
1108,2022-05-22,Nogent-sur-Marne,trs du par conseillre en semaine avertissement de radiationre fois parce que je ne peux pas participer au rdv et jessaie de trouver une autre dateeme fois parce que je suis positif au covid alors que jai envoye mon pcr positifdans aucuns cas rpondu par mails ils sont trs malveillants du moins conseillreje dconseille fortementenfin si jamais avait le choix cest pas avec eux que je collaborerai,0.895762249827385,Negatif
1109,2020-05-22,Nogent-sur-Marne,totalement dcevantaucune considration de la des conseillers du ple emploi de cette agenceon vous fais dplacer pour rien et ose vous mentir au visage en vous racontant des saladeson limpression de les drangerdailleurs se demande bien pourquoi ils sont pay ah oui pour vous emmerder avec des lettres de menaces de radiationinadmissible,0.9876726306974888,Negatif
1110,2020-05-22,Nogent-sur-Marne,nous sommes le lundi de pentecte jai enfin le temps de faire un passage chez vous pour un rendez vous internet vous dit ouverts vous tes ferms pour un tel groupe personne nest capable de mettre jour les paramtres google douverture tonnant,0.8168315887451172,Negatif
1111,2018-05-23,Nogent-sur-Marne,si vous navez besoin de rien tout va bien sinon passez votre route faites un recommand ou un mail car humainement cest zro ils veulent refourguer leur formations en interne mme lorsquon en pas besoin et surtout si fait une demande pour une formation exterieure vivement que ces incapables ailles aussi pointer ce qui ne serai tarder et avec un peu de chance ils devront ngocier avec des gens aussi idiots queux,0.951789528131485,Negatif
1112,2017-05-23,Nogent-sur-Marne,aprs avoir appel et attendu minutes donc trs peu quelquun tait au bout du fil mais sans rponse jai du raccrocher et recommencer essai minutes aprs ple emploi vous remercie au final ils mont raccrocher il tait h lheure de la pause est primordial apparemmentoblig dattendre encore demain matin pour les rappeler,0.7820112407207489,Negatif
1113,2016-05-23,Nogent-sur-Marne,trs peu de contact jai demand fois que lon rappelle durgence pour un conseil et confirm que consultante mappelerait je vais devoir dplacer pour avoir une rponse une question simple pole emploi ne servi absolument rien depuis que je suis inscrite les conseillers ne donnent aucun conseil ne guident pas dans les dermarches et nappellent pas pas tonnant quil ait millions de chomeurs en france si pe nogent est une rfrence alors je minquite pour la courbe du chmage,0.9301280677318573,Negatif
1114,2017-05-23,Nogent-sur-Marne,disponibilit de conseil et postes de consultation informatique assiste organisation des rendez vous offrant une rgularit des conseils suivi personnalis respectueux du rythme individuel,0.9154537320137024,Positif
1115,2022-05-22,Nogent-sur-Marne,juste par se que pas le droit de se rtract ou changer davis nous envoie une lettre de radiation et menace de supprimer nos allocation cest du nimporte quoi,0.9701222702860832,Negatif
1116,2020-05-22,Nogent-sur-Marne,site internet nul impossible de lire les messages sans les tlchargerjai une adresse mail mais bon cest plus facile pour eux,0.9745903611183167,Negatif
1117,2020-05-22,Nogent-sur-Marne,les conseillers sont l pour vous et sont agrables si leur parle agrablement ils mettent laise,0.5566525459289551,Positif
1118,2019-05-23,Nogent-sur-Marne,que cette agence ait mal conseill un jeune sans emploi lui faisant perdre par son manque de ractivit une opportunit dobtenir un contrat pro et daccder un premier emploi,0.8205359876155853,Negatif
1119,2019-05-23,Nogent-sur-Marne,cest une agence taille humaine ou lon est votre coute,0.6545203030109406,Positif
1120,2023-04-22,Nogent-sur-Marne,sympathique agence de quartier en revanche ou conseillers sont tout simplement vomir sur le plan humain,0.734664261341095,Negatif
1121,2023-03-23,Paris,inadmissible et honteux tout simplement attente pendant h aprs lheure du rdv tout pour quon dise que le rdv tait annul mais quils avaient oubli de prvenir comment estce possible alors que cest cens tre votre mtier puis proposition dun nouveau rdv dans semaines et ddommagement de plus lannulation est la personne soccupant du dossier qui ne sait pas lire le franais visiblement sur un formulaire lectronique pr rempli,0.9881944097578526,Negatif
1122,2023-01-22,Paris,accueilli par une personne fminine dun ge certain trs dsagrable qui sexprime mal et sagace aprs une mauvaise comprhension certainement une ancienne bergre qui na pas lhabitude de grer des personnes civilises conseillers et dirigeants trs bien,0.4859589636325836,Neutre
1123,2023-05-08,Paris,je suis hassan bashir jai besoin de rendezvous sil vous plat jai un problme avec mon dossier,0.45916201174259186,Negatif
1124,2022-05-22,Paris,de loin la pire agencedune incomptence sans nommon indemnisation bloque sans raison pendant deux mois et ils ont oublis de dcocher une case sur leur systme pour dbloquer la situation ils perdent des lettres quon dpose lagence ils sont incapables de grer une demande de droit doption jattends depuis moisun conseil retrouvez un travail au plus vite,0.9784551300108433,Negatif
1125,2023-02-21,Paris,je suis alle une runion collective au ple emploi brancionet jtais dans une partie des locaux aprs le numro dans lamphithtre,0.37329936027526855,Positif
1126,2022-05-22,Paris,ct spectacle hormis la manageuse qui connait son travail le reste de lquipe et la structure est totalement incompatible avec le fonctionnement du mtier dartisterenvoi des responsabilits vers la croix nivert qui fait de mme quand les contacte perte des documents non traitement de dossier et pire que tout un conseiller qui affirme quil ny pas demploi pour le moment et les offres quon propos taient primes,0.9652349352836609,Negatif
1127,2021-05-22,Paris,jai pass un entretien avec un conseiller ple emploi avec qui cela sest trs bien pass conseiller trs aimable lcoute et qui eu des conseils et un discours adapts situation merci da costa bas les clichs sur ladministration il existe des personnes trs comptentes et impliques et cela mrite dtre valoris,0.8124382495880127,Positif
1128,2022-05-22,Paris,aujourdhui des personnes sans comptence ont la main mise sur nos droits les services ple emploi sont infectes et nuls je vais devoir passer par le dfenseur des droits pour pouvoir ouvrir mes droits fatigant,0.9386219829320908,Negatif
1129,2020-05-22,Paris,trs mauvaise exprience auprs dun conseiller impoli un peu trop laise dans ses propos incomprhensif sexprimant avec un ton ddaigneux comme jai rarement vu auparavantjespre que la prochaine fois je tomberai sur une conseillere plus professionnelle et sympathique avec qui changer de manires cordiales et respectueuses,0.962146669626236,Negatif
1130,2021-05-22,Paris,le pire entretien tlphonique de toute vie cest la premire fois quune administration raccroche au nez pourtant tout se pass trs bien javais de bons conseils venant dune soidisant conseillre et soudain nervement total de mon interlocutrice mais sincrement ple emploi brancion qui est zabar zoubaida une schizoune pseudoconseillre ou une anomali dans le service,0.9030481725931168,Negatif
1131,2020-05-22,Paris,gros priori sur ladministration bureaucratie franaise force est de constater que ce fut rapide efficace presque agrable compte tenu des circonstances merci mon conseiller pierre yves ce matin qui fut sympathique empathique de bon conseil bas les clichs il avait des gens pas contents pendant que jy tais renseignonsnous respectons les rgles soyons lcoute il des bons professionnels lbas,0.6867055892944336,Positif
1132,2019-05-23,Paris,nul changement de conseillers aprs chaque entretiens mois dattente entre chaque rdv la psychologue du travail vous refuse l accs la formation car elle juge que vous avez trop de problmes ils se couvrent tous entres eux aucun dialogue possible car ils prennnent les gens pour des sousdous alors que eux mme le sont pour conclure le seul de ces entretiens est de pianot sur le clavier une brve conclusion mensongre comme quoi le conseiller et le candidat sont en accord avec ce qui sest dit ok avec de la sottise quoi,0.9863049387931824,Negatif
1133,2017-05-23,Paris,ou personnes l accueil gnral sont compltement mal luns je plains une annonce quils ont envoy et qui ne correspond en rien mes comptences ils menacent avec des phrases toutes faites du type il est temps de retouner travailler en quoi c est pas un emploi pour vous ils ne connaissent pas mon dossier jtais au chmage depuis mois et ils ont finit par coller un entretien avec mon conseiller perso qui est limite dpressif qui son tour coll un coaching personnalis distance avec une socit prive si vous avez lair totalement inemployable ils vous embtent pas trop si cest pas votre cas ils vous culpabilisent devant tout le monde,0.9430643618106842,Negatif
1134,2019-05-23,Paris,comme il est mentionn cidessous un vrai changement est notable et celuici est trs ngatif depuis cette anne jai rarement aussi mal reue pour un appel si la personne dcroch aprs quelques minutes dattentes celleci fait patienter quelques instants des instants qui ont dur grosses minutes,0.6471686065196991,Negatif
1135,2022-12-23,Paris,accueil professionnel ont rpondu mes questions,0.932654619216919,Positif
1136,2019-05-23,Paris,un accueil sans prcdent au tlphone ne les drangez surtout pas si vous avez besoin dun renseignement cela dpendra de leur humeur jespre quaprs demande je naurai plus affaire eux calamiteux,0.46762771904468536,Positif
1137,2022-05-22,Paris,cest une honte que du bricolage jen ai jamais vu ils sont du mauvaise humeur tout le temps que des amateurs et ils sont racistes en plus je suis oblig de donner une toile,0.9909606762230396,Negatif
1138,2018-05-23,Paris,bonjourje suis dsoler pour ce commentaire mais cest vrai que le ple emploi de brancion est trs dsagrable au niveau de personnelle et aussi concentration de travailcar jai eu un rdv de er entretien avec une conseiller mais cause de lors problems systme depuis mois jai eu des changements de rdv jusqu prsent mais je nai toujours pas vu un conseillermme si cest leur faute il ne prends pas la responsabilitils travaillent sans les responsabilits alors que le service de ple emploi est quelques choses trs importantes pour les jeunes de ans comme nous merci de prendre srieux et voir fonctionnement de cette agencecordialement,0.49752986431121826,Neutre
1139,2019-05-23,Paris,agence nulle le personnel est incomptent et indisponible il ne rpond ni aux mails ni aux appels tlphoniques une conseillre mme avou quil ne fallait pas donner les justificatifs papiers en agence car les papiers sont perdus,0.9834539666771889,Negatif
1140,2017-05-23,Paris,pas possible de dposer un dossier aprs h ferm le vendredi ils vous mettent la pression ridicule,0.9532593488693237,Negatif
1141,2017-05-23,Paris,trs propre organis scurise acceuill trs sympa dlai dattente favorable rien dire,0.8320843279361725,Positif
1142,2019-05-23,Paris,bonjour tout le monde je cherche un emploi en france je parle plusieurs langues je suis brsilienmerci davance,0.6728335618972778,Positif
1143,2018-05-23,Paris,contact tlphonique revoir min dattenterdv avec conseiller amliorer mais reste simpliste,0.4511511027812958,Neutre
1144,2021-05-22,Paris,une quipe trs efficace sort des clichs,0.8511312901973724,Positif
1145,2020-05-22,Paris,tres bonne quipe au service entreprise l ecoute et disponible sur place,0.9493235647678375,Positif
1146,2019-05-23,Paris,le personnel fait ce quil peut malgr laffluence,0.5372226685285568,Positif
1147,2018-05-23,Paris,service rapide et efficace pour,0.9180582761764526,Positif
1148,2021-05-22,Paris,,0.49993762373924255,Positif
1149,2017-05-23,Paris,estce normal que le pole emploi ferme h,0.3987840265035629,Negatif
1150,2019-05-23,Paris,ne rpond plus lidologie de sa cration,0.6844777762889862,Negatif
1151,2021-05-22,Paris,bravo tous lquipe bravo,0.945472240447998,Positif
1152,2021-05-22,Paris,,0.49993762373924255,Positif
1153,2017-05-23,Paris,perfect service team professional bright new building,0.6946823298931122,Positif
1154,2023-02-21,Noisy-le-Grand,que mon inscription ne peut aboutir car il manquait une pice je peux comprendre mais que le conseiller vous dise que mon dossier peut attendre encore un peu parce que jai cadre il plus de ans et que je peux vivre encore quelque temps sur mes conomies parce quil plus misrable que moi dune jai un petit autoentrepreneur depuis que je ne suis plus cadre et de deux jai toujours cotis comme tout le monde dans carrire professionnelle en tant quemploye cadre et autoentrepreneur jai donc droit aux indemnits chmage qui reviennent de droit,0.4753841459751129,Negatif
1155,2022-05-22,Noisy-le-Grand,frquentes se ple emploi depuis des annes je vais pas prononcer sur ce comment cela peut se passer en agence les autres commentaires parle deuxmmes en revanche jai convoqu par nouvelle conseillre tant donn que mon ancien conseiller est parti la retraite je suis trs satisfaite du premier rdv avec mme ballardpersonne correcte lcoute et cherche des solutions et cest ce quont recherchent jespre que continuera sur cette voie je vous en remercie,0.9156999588012695,Positif
1156,2023-02-21,Noisy-le-Grand,excellente exprience ce jour malgr les difficults lis mon dossier jai finalement pu repartir avec une inscription effectue je tiens remercier toute lequipe avec laquelle jai en contact et particulirement maria theresa gomez qui fait preuve de persvrance,0.9395601451396942,Positif
1157,2022-11-23,Noisy-le-Grand,pas agrable ne rpond jamais aux tlphones agressif au tlphone impossible den placer une,0.986264131963253,Negatif
1158,2022-07-26,Noisy-le-Grand,jai agrablement eu une bonne accueil lors de mon rendez vous du la personne laccueil tait positif un grand merci,0.9057410061359406,Positif
1159,2022-05-22,Noisy-le-Grand,inadmissible nous envoyons tout les documents possibles pour finaliser et nous redemande les mmes choses encore et encore et pour le moment aucun droit nest attribu pire encore la dernire une attestation de mais va quand allez vous enfin nous aider et nous rendre les choses simples la mairie vous fait la teletransmission ne marche pas vous envoie tout mois en avance ne marche pas appel personne rpond quand nous rappel nous crie dessus et une version diffrent dune personne lautre une fois tout est ok et une fois il manque un document et aprs un autre,0.9779902324080467,Negatif
1160,2020-05-22,Noisy-le-Grand,pire exprience avec ple emploi les personnes ne sont pas aimables mal leves et incomptentesje venais juste pour avoir un papier pour formation aprs min dattente au guichet pendant lesquelles une conseillre et une responsable cherchaient mon dossier sur le net tout en discutant de leur problmes de couples la responsable est venu voir comme une furie sans se prsenter en parlant extrmement mal et en tant trs nerv contre moi aprs avoir vu le salaire que ple emploi versaitbref min de dialogue de sourd pour au final avoir rgl mon problme en appelant un autre ple emploi en min montre en mains le lendemaince ple emploi est fuir,0.9784234538674355,Negatif
1161,2022-05-22,Noisy-le-Grand,si je pouvais mettre zro toile mme je le ferai des personnes imbues de leur personne qui te traitent comme des moins que rien limite tu nas mme pas envie dy aller,0.9627678245306015,Negatif
1162,2018-05-23,Noisy-le-Grand,trs trs mal reuparle mal aux jeunespersonne ne dsire travailler sur placeles jeunes ne sont pas pris en charge comme il se doitpremire et dernire fois que je rend je prfre rester la rue qutre accueilli comme un chienune chose que je ne comprend pas en revanche cest que malgr tous ces avis ngatifs que jai lu sur ce lieux pourquoi aucune disposition na prise ce jour je ne marrte pas qu se simple avis google jcris au suprieur les personne souhaitant partager leur exprience au ple emploi de noisy le grand merci de prendre contact avec moi,0.836648240685463,Negatif
1163,2020-05-22,Noisy-le-Grand,conseillre est trs sympathiquejoignable lcoute et disponible pour les diffrents agents mayant reu je dirais simplement merci pour laide et toutes les informations apportes,0.9152410626411438,Positif
1164,2018-05-23,Noisy-le-Grand,il nous accueille juste pour sen debarasser et pour regler truc faut laisser ton travaille et courire chey eux plusieur foi alor que cest eux qui cree les problem,0.4998514950275421,Negatif
1165,2020-05-22,Noisy-le-Grand,depuis de nombreuses anne cette agence est peuples incomptents et de personne mal aimable que faire c est un constat plus affligeant,0.9592351764440536,Negatif
1166,2016-05-23,Noisy-le-Grand,tres mal recu et prenne enormement de temps pour occuper un dossier en cour,0.9015139043331146,Negatif
1167,2017-05-23,Noisy-le-Grand,vous donne une feuille pour vous dire que va arranger la situation et en effet arrange leurs situation vu que vous radie merci pole emplois,0.4352116286754608,Positif
1168,2016-05-23,Noisy-le-Grand,attention ferme l aprs midi donc oblig de prendre une journe absence au travail pour aller le matin flicitation,0.5056721717119217,Positif
1169,2021-05-22,Noisy-le-Grand,dix minutes dans une gare noisy le champssurmarne,0.474886953830719,Negatif
1170,2021-05-22,Noisy-le-Grand,grands professionnels ils ont rsolu tous mes problmes professionnellement,0.9661599397659302,Positif
1171,2019-05-23,Noisy-le-Grand,catastrophique convocation pour rien pour des ateliers qui nont pas dinteret,0.9920213744044304,Negatif
1172,2020-05-22,Noisy-le-Grand,ple emploi situ en face dun lyce rien de plus dire et pas de sous entendu faire,0.6486817002296448,Positif
1173,2017-05-23,Noisy-le-Grand,ple emploi compltement incomptent conseillre inutile,0.8869116008281708,Negatif
1174,2016-05-23,Noisy-le-Grand,impossible de les joindre par tlphone vraiment dcevant de leurs,0.9582163840532303,Negatif
1175,2020-05-22,Noisy-le-Grand,conseillre incomptente personnel dsagrable,0.3879616856575012,Negatif
1176,2016-05-23,Noisy-le-Grand,tres bien recu pour information,0.8688323199748993,Positif
1177,2016-05-23,Noisy-le-Grand,pouri devrai changer la direction,0.3627454936504364,Negatif
1178,2016-05-23,Noisy-le-Grand,l accueil,0.5878173112869263,Positif
1179,2022-09-24,Noisy-le-Grand,staffs helpful like dont care especially receptionthis unacceptable sad,0.9082954525947571,Positif
1180,2022-05-22,Paris,rdv le cette agence jaccompagne une amie pour la soutenir la conseillre au fort accent de lest fait une slection direct sans mme demander pourquoi nous sommes quand elle nous le demande le ton est inquisiteur et elle se perd en explications vasives jai moi mme travaill au ple emploi et ces manires de slection sont juste inadmissibles tout le monde droit au respect et tre assist sil le souhaite sans avoir se justifier sappelle linquisition dommage javais une bonne image de cette agence lattitude de cette dame est juste incomprhensible elle mme demand de sortir pour ne pas encombrer la salle dattenteil avait personne oblig donc dattendre mon amie dehors dans le froid bonjour lhumanisme,0.7616144716739655,Negatif
1181,2023-05-01,Paris,bonjour jai trs bien conseille et suivie par laurence fouretmerci pour votre aide,0.9118830859661102,Positif
1182,2022-05-22,Paris,carricature parfaite de ce que lon peut dire de pole emploi personnes incomptentes ntant pas en mesure de vous expliquer quoi que ce soitde plus prend les gens de haut en minformant de leurs travail sans pause dactivit durant le covid etant de la restauration jaurais aim avoir ce choix madame le grand pole emploi la hauteur de leurs rputation naze,0.866738423705101,Negatif
1183,2023-03-23,Paris,la responsable pas du tout conciliante et autoritaire je ne recommande pas cette agence,0.9810329675674438,Negatif
1184,2022-08-25,Paris,trs bonne exprience au sein de cette agence concernant laccompagnement intensif individualis des jeunes conseillre bienveillante attentive et disponible,0.9165131151676178,Positif
1185,2022-05-22,Paris,attention cette agence quand vous durcissez le ton pour exiger un suivi vous faites face des appels anonymes menaants des falsifications de pices informatiques parfaitement illgale et rcemment jai dcouvert que quelquun allait sur mon espace personnel pour scanner des pices mon insu je garde le max de preuves pour saisir la justice ce sujet je ne vais pas gner sinon en terme de services je voudrais mettre zero administration aussi mdiocre quinutile jinvite els gens contacter mdiapart pour dnoncer quand vous rencontrez des problmes avec ces gensl cest bien que se sache,0.8852701187133789,Negatif
1186,2021-05-22,Paris,les personnes qui crent le dossier et que lon voit la premire fois sont lents mais sympathiquesles conseillers quant eux sont inutiles et naident pas du tout ils ne sont pas lcoute et ne peuvent mme pas vous adresser quelquun concernant le dossier dindemnisation ils ne sont pas disponibles et accueillent les demandeurs demploi la chane dsastreux,0.8282045125961304,Negatif
1187,2022-10-24,Paris,trs bonne prise en charge de lagence pour les formations mme fouret est une conseillre efficace et trs lcoute,0.9327789545059204,Positif
1188,2020-05-22,Paris,je suis plus que satisfaite de laccompagnement de ce pole emploi laccueil est agrable et souriantdes conseillers gentils et motivants je suis suivie par deux femmes lune pour laccompagnement lautre pour lindemnisation qui maident et agissent rapidement si jen ai le besoin,0.9798041880130768,Positif
1189,2018-05-23,Paris,pleemploi est un lieu de tous les possibles il ne peut pas fournir du travail clefenmain comme beaucoup le voudraient mais il peut aider beaucoup pour autant que les chercheurs demploi le veuillent sincrement videmmentje connais cette agence les agents qui travaillent sont de trs trs grande qualit ils font toujours de leur mieux pour aider dans la mesure des moyens qui sont les leurs,0.935071587562561,Positif
1190,2020-05-22,Paris,bonjour je ne comprend pas que ple emploi desinscrit malgr je fait mon actualisation tous les mois jai demand pourquoi je ne suis plus script comme demandeur demploi et rpondu que jai fini une formation pour jai tait desinscrit automatiquement jai tait surpris parceque jai pas fait de formation mais une remise niveau et ple emploi se permet de dsinscrire un demandeur demploi je travaille toujours pas et je ne suis plus considr comme demandeur demploi h suis dgot,0.8116602301597595,Negatif
1191,2017-05-23,Paris,toile tu rve ils mritent alors trs bonne histoireje suis arriv en france il mois avec un visa pvt programme vacance travail pour lge de ans alors ont comprend bien que permet de travailler nonjarrive au rendezvous et l dame demande mon visa elle dit quelle ne connais pas ce visa et si jai un autrs permis de travail mais non je vien du canada avec un visa pour travailler elle mme pas fait de recherche et je suis parti sans aidepassez pas chez ple emploi ci vous tes tranger pas la peine,0.8474751710891724,Positif
1192,2016-05-23,Paris,venu faire des phocopies de fiches de paie jai trouv les bureaux ferm h par contre une personne rpondu et dit quil tait ouvert seulement le matin jusqu h alors quavant il ltait jusqu h question pourquoi il avait du personnel quon rpondu mais quils tait ferm dsol de bizarre travailler et de ne pouvoir passer le matin cest se foutre de nous et aprs se demande pourquoi il autant de chmeurs,0.7295025885105133,Negatif
1193,2022-05-22,Paris,bonsoirpour ce moment trs ngative opinionles erreurs des travailleurs jespre que vous allez amliorer des que possiblemeilleures salutations,0.3678635209798813,Positif
1194,2020-05-22,Paris,jai trs bien reue trs bien renseigne par le personnel daccueil puis par la conseillre ple emploi qui trs agrable et trs professionnelle,0.9209970831871033,Positif
1195,2021-05-22,Paris,je suis ravie de laccompagnement de ce ple emploi les conseillers gentils lcoute et motivants,0.9570778906345367,Positif
1196,2019-05-23,Paris,agence catastrophique toujours bonde vous renseigne mme pas si vous avez rdv ou pas vous attendez plus dune demiheure pour rien un manque grave dorganisation vous allez le constater vous mme,0.9588410407304764,Negatif
1197,2019-05-23,Paris,personnel aimable et comptentqui fait ce quil peut au vu de la difficult et de lampleur de la tche,0.5366307497024536,Neutre
