,Date de publication,Ville,Avis,Score,Type
1541,2023-03-23,Maisons-Alfort,personnel trs dsagrable et hautain ne peux pas poser de questions sinon sen prend pleins la tte il faudrai changer de personnel,0.5657092928886414,Negatif
1542,2022-05-22,Maisons-Alfort,je tiens remercier les personnes laccueil de lagence bienveillance professionnalisme votre coute pour comprendre votre situation et vous aider rien ne vaut la communication humaine un grand merci toute lquipe,0.9691497087478638,Positif
1543,2021-05-22,Maisons-Alfort,avis modifiune premire exprience avec un conseiller trs ngative et une seconde avec une autre conseillre trs positivela premire tait une erreur venant de leur et ils nous demandent de rembourser le trop peru mme si toutes les dclarations ont faites en bonne et formela seconde est une super conseillre qui beaucoup aid et trs bien accompagn dans mes projetsje vous conseille de toujours demander des cris et de ne jamais faire confiance aux parolesils malheureusement plusieurs services qui sont incomptent et harclent sans prendre en compte les lettres envoys,0.41945090889930725,Neutre
1544,2022-05-22,Maisons-Alfort,mon fils tait inscrit ple emploi en aot dernier lors de son rendez vous lui avait assur qu il aurait un rdv avant le septembre depuis rien mon fils essaie de trouver un travail il un niveau bac en photo et souhaiterait faire de la vente je trouve dplorable de laisser des jeunes dans la galre comme sans rien faire,0.9123772382736206,Negatif
1545,2022-05-22,Maisons-Alfort,cadre trs bon et convivialtout le personnel tait trs serviable et poli en particulier mon conseiller en emploi tait trs bien inform sur toutes les questions qui concernaientcela beaucoup aid merci,0.950655996799469,Positif
1546,2022-05-22,Maisons-Alfort,je le suis rendu lagence ce jour jai trs mal accueilli par une employe rpondant au prnom de blueberry comportement excrable elle ne supportait pasvisiblementde devoir faire son travail alors je suggre quelle aille chercher du travail ailleurs elle envoy balader aussi la personne qui tait aprs moi cette blueberry na rien faire ce poste,0.9461376219987869,Negatif
1547,2021-05-22,Maisons-Alfort,rdv lundi dernier reu pas une conseillre extrmement comptente et dune grande gentillesse lagence est trs bien tenue et situ dans un quartier au calme,0.8327445983886719,Positif
1548,2021-05-22,Maisons-Alfort,juillet lagent laccueil croit que je parle de lui lorsque je lui dis vous alors quil reprsente lentit ple emploi oblig de lui expliquer son statut de reprsentationils nont pas accs mon dossier qui soidisant transfr par le ple emploi de castelnaulelez montpellier la responsable dagence na soidisant aucune possibilit de joindre lagence de castelnauvous savez que le tlphone existe depuis plus de ans,0.8200552761554718,Negatif
1549,2021-05-22,Maisons-Alfort,il ya des pc imprimantes et scanners pour les pmr avec des places assises le service est personnalis les aprs midi sur rendezvous le site est accessible et il ya mme une bote aux lettres une tablette lintrieur pour sannoncer concernant les rdv individuels ce qui rduit lattente,0.8243764340877533,Positif
1550,2021-05-22,Maisons-Alfort,horrible dj juste voir la photo lon voir un des conseillers accouder sur son bureau se demande comment ils peuvent aider les genscarrment ils avaient fais un versement de mon chmage sur un autre compte bancaire qui ne mappartenait mme pas bnp alors que je suis la banque postale je sais pas comment ils ont pu se tromper de iban heureusement que le compte tais clturer et que le paiement est revenu au point de dpartjuste un mot cette agence et les conseillers sont horrible,0.945863850414753,Negatif
1551,2022-05-22,Maisons-Alfort,bizarrement ou pas mais les personnes de laccueil ont fort aimable et nous ont aids pour lactualisation de notre dossier elles ont vraiment pris le temps merci elles,0.6508860737085342,Positif
1552,2020-05-22,Maisons-Alfort,agence au je nai heureusement pas souvent loccasion de passer par la case ple emploi dans vie mais il faut dire que les commentaires sont justesils font un super travail et laccueil est agrable,0.7916654944419861,Positif
1553,2022-10-24,Maisons-Alfort,pas professionnelle du tout vous raccroche au nez et ne parle pas des gens incomptents qui manque dducation,0.974345475435257,Negatif
1554,2020-05-22,Maisons-Alfort,que soit au tlphone ou directement lagence jai toujours accueillie et coute rapidement par des conseilleres et personnes laccueil qui ont trouv des solutions mes problmes et mont conseille avec professionnalisme et bienveillance,0.9453887045383453,Positif
1555,2019-05-23,Maisons-Alfort,agence jamais bonde accueil sympathique et personnels trs professionnels et efficaces trs loin de limage de ple emploi,0.6195871233940125,Negatif
1556,2021-05-22,Maisons-Alfort,conseiller sympa pour aller en transport en commun cest pas vident quand pas de voiture,0.6514078974723816,Positif
1557,2022-05-22,Maisons-Alfort,dune nullit sans nom beaucoup dincomptents,0.9953188505023718,Negatif
1558,2018-05-23,Maisons-Alfort,excellent accueil et conseils de qualit,0.9734313786029816,Positif
1559,2022-07-26,Maisons-Alfort,france time gets super service friendly people section,0.9279181957244873,Positif
1560,2022-12-23,Vitry-sur-Seine,personnel peu agrable qui nhonore pas le service public cest navrant,0.9696380496025085,Negatif
1561,2022-05-22,Vitry-sur-Seine,je nai jamais vu des personnes aussi hautaines dsagrables dgotantes mme jai en agence ce matin vitry sur seine je suis tombe sur un homme qui tait dans un bureau en face de laccueil il dsagrable au plus au point il ne absolument pas laiss en placer une il na fait que dire non je ne vous laisse pas parler et votre situation mest compltement gale cest une faon de parler degueulasse quil est jai une forte envie de linsulter de tous les noms mais je vais en rester l la plupart des commentaires sont similaires au mien posez vous des questions et arrtez de croire que vous petez le score avec votre poste chez ple emploi bande dincapables,0.95572679489851,Negatif
1562,2022-05-22,Vitry-sur-Seine,bonjour tous le monde je vous conseille de ne pas vous inscrire vous aurez que des problmes laccueil de ple emploi ce fait le matin pour avoir un conseiller trs difficile obtenir pour le courrier il faut avoir un mail une photocopie chez soi ont vous donne pas information non plus de formation jai remarqu tous les gens leur doivent de largent comme il sappelle sa trop peru il ador,0.4564020484685898,Negatif
1563,2022-05-22,Vitry-sur-Seine,conseillre hystrique qui vous guel literallement dessus elle se reconnatra jai jamais eu une conseillre aussi incomptente et orgueilleuse cest vomir,0.9094569683074951,Negatif
1564,2020-05-22,Vitry-sur-Seine,je suis inscrite ple emploi depuis le er aout j ai tres bien accueillie renseigne je suis secrtaire medicale en obsttrique avant je trouve navrant que le premier poste qu propose c est un poste de secrtaire en radiologie c est un service assez spcifique ou ne donnera pas le temps apprendre etant donn mon ge et de plus levallois perret je n ai pas de permis alors que mois j ai envoy des dizaines de cv des demandes emploi ds le ok pour l instant je n ai qu une reponse negative ms il de l embauche ds mon domaine pourquoi envoyer ds un secteur je ne connais riencordialementpeu dommage,0.6387105584144592,Negatif
1565,2019-05-23,Vitry-sur-Seine,je donne mon avis jaurais aim mettre toile met sa marche pas dommage je vous explique pourquoi pour prendre rendez vous avec ple emploi de vitry sur seine super compliquer personne rpond aprs il os nous dire ple emploi vtre coute faite attention pour ce qui et des dmarche pour notre indemnisations des super retard son attendu je vous previent et le octobre alors que je devais rservoir mon payement chmage le octobre sachant que jai un loyer et manger payer dite moi comment fais pour survivre au chmage si des incomptents font mal leur travaille,0.6803663074970245,Negatif
1566,2022-05-22,Vitry-sur-Seine,trs mauvais ils parlent au demandeur demploi surtout une conseillre qui se reconnatra quand lui demande une info elle rpond quelle na pas que faire ou bien il fallait penser avant zro humanit,0.965182363986969,Negatif
1567,2017-05-23,Vitry-sur-Seine,les nouveaux locaux sont trs bien agrable je dirais mmecependant quand un numro de tlphone ou vous serez joignablea vitera beaucoup de dplacement au personnes en qute dun renseignement et de votre cot dgorgera un peu tout le public que vous recevez le matin,0.5118028521537781,Positif
1568,2022-05-22,Vitry-sur-Seine,franchement super accueiltrs bon conseill franchement nickel,0.9865803420543671,Positif
1569,2019-05-23,Vitry-sur-Seine,incomptent annulation de rendezvous sans excuse,0.7589688152074814,Negatif
1570,2019-05-23,Vitry-sur-Seine,incomptence au maximum du jamais vu,0.7667088434100151,Negatif
1571,2017-05-23,Vitry-sur-Seine,pas de numro,0.5472901910543442,Negatif
1572,2023-05-08,Vitry-sur-Seine,un peu dattente mais partie avec la rponse question,0.62033711373806,Positif
1573,2023-02-21,Cergy,quand les appelles ils font sans blanc davoir des coupure et nous dit que cest notre rseau tonnamment quand leur donne des identifiant ou quoi pareil refuse des attestation employeur sans savoir pourquoi et mme en les envoyant de manire diffrente cela ne fonctionne tjrs pas sans savoir bref comme peut sans douter des vrais ces types mais par contre vont vous prendre de haut,0.911207303404808,Negatif
1574,2022-05-22,Cergy,bonjouravant confinement au ple emploi il avait une longue queue et lattente trs longuedes fils de queues incomprhensibles ne sait pas se mettreon se marchait dessus et pas assez de place pour tout le mondecertains conseillers sont sympas dautres pas du toutbien cordialement,0.6821547895669937,Negatif
1575,2022-09-24,Cergy,pour jai eu une conseillre dcourageante avec menace de radiation pour raison non valable aucun rel suivi ni soutien qui pousse vers la sortie de la mauvaise manire heureusement que jai pu men sortir sans son aideje vous souhaite de ne pas tomber sur cette conseillre,0.970585286617279,Negatif
1576,2022-12-23,Cergy,personnel trs agrable et lcoute juste une etoile en moins pour les difficults de stationnements pas de place disponible proximit,0.6536247581243515,Positif
1577,2022-12-23,Cergy,juste pour effectuer un petit traitement de documents ou avoir une information basique chez eux cest le parcours du combattant,0.6453793048858643,Negatif
1578,2022-07-26,Cergy,javais eu de gros soucis avec ple emploi il quelques annes aujourdhui je suis suivis par une conseillre juste topje met pas son nom car je ne sais pas si jai le droit en lespace de rdv elle aid refaire au mieux mon cv envoy des annonces demploi similaire mes recherches je ne pensais pas retrouver un travail dans mon domaine mais grace conseillre jai enfin trouv lemploi de mes rves merci madame,0.8155949115753174,Positif
1579,2022-05-22,Cergy,jai mis une toile parce quon ne peut pas valider le post sans toileattendre min au tlphone pour quon vous raccroche au nez sans mme prendre le temps dcouter la demande dpasse le stade du manque de respectvoil comment crer un problme l un simple dsol je nai pas la rponse et un nom auprs de qui prendre attache aurait suffitjai bien leve donc je reste polie mais srieusement avec ce genre dattitudes vous tonnez pas du ressentiment que vous cr chez les gensvotre vie doit tre vraiment triste pour que vous ne soyez mme pas capable du minimum cest pathtique,0.869527205824852,Negatif
1580,2020-05-22,Cergy,je donne ces toiles pour ceux qui travaillent comme elles peuvent jestime que ces personnes mritent voir les toiles par contre dautres mritent aucune toile au vu de leur indiffrence leur aminuisite et jai sentis du mpris et racistes je sais que surtout le dernier mot est dure mais croyaient je pse bien mes propos et cest envers une seule personne ge alors quune lorsque je lui ai pose la mme question elle rponduje demande au directeur de bien surveiller ses collaboratrices et pourquoi pas mettre en place un questionnaire de satisfactionje voudrais bien avoir un rendezvous avec le directeur,0.5931483209133148,Negatif
1581,2019-05-23,Cergy,impossible de les joindre au tlphone le service rappel ne fonctionne pas ou rappelle laisse en attente puis raccroche documents envoys lespace personnel toujours non traits aprs une semaine informations errones donnes par les conseillers au tlphone quand arrive enfin les avoir au bout du appel toujours pas dindemnisation sur juin reoit une notif dun nouveau courrier dans lespace personnel et en se connectant rien il faut attendre le lendemain pour le voir apparatre service lamentable,0.9892896041274071,Negatif
1582,2019-05-23,Cergy,incapables de grer correctement mon dossier dindemnisation rclament plus de euros alors que cest ple emploi qui se trompe et ils le reconnaissent pas de responsable qui prenne les choses en main etc est oblig de mettre une toile cest dommage vaut zro,0.9392615258693695,Negatif
1583,2019-05-23,Cergy,est jeudi jessaie de les joindre depuis h il est h jai toujours la mme rponse aucun agent nest disponiblea quelle heure fautil les appeler jai laiss un message pour quon rappelle dans les h toujours pas de nouvelles au bout de jours,0.9085365235805511,Negatif
1584,2020-05-22,Cergy,inacceptable je comprends pas pourquoi vous engagez des personnes qui son sens aider les autres ce nest absolument pas le cas ok demande de laide aux ordinateurs elles sont entrin de parler entres elles de la pluie et du beau temps snobe quand pose des questions et ne veulent pas prendre le temps daider donc vraiment revoir decevant,0.9919831976294518,Negatif
1585,2019-05-23,Cergy,je ne comprends absolument pas pourquoi il ny pas de superviseurs cris une rclamation pas de rponse mais ils la notifies en traite se dplace vous dit cest en cours et en faites rien nest fait pdt que dautre cherche du boulot une honte,0.9873445928096771,Negatif
1586,2020-05-22,Cergy,vraiment une catastrophe les conseillers nont aucune connaissance nous sommes trs mal renseigns et vraiment pas aids trs hautains avec nous comme si nous sommes de gros dbiles,0.9966811314225197,Negatif
1587,2021-05-22,Cergy,des facilits pour les chmeur dites vous ordi verrouill leur simple app tout le temps laccs est limit photocopie blasfam avec leur logo rdv trop espac,0.8036537766456604,Negatif
1588,2021-05-22,Cergy,service indemnisation impoli dsintress de leur metier ils nexpliquent rienen gros dbrouillez vous cest nimporte quoi ce pole emploifaut le fuir,0.9921894446015358,Negatif
1589,2022-09-24,Cergy,trop de paperace pour je dconseillepersonne ne vie avec,0.9122041165828705,Negatif
1590,2020-05-22,Cergy,la plupart dentre ce sont des incomptents ils ne savent mme pas croit te rpondre quand tu leurs pose des questions ils prfrent te raccrocher au nez et quand tu leurs demandent de tappeller sur h il tappelle au finale il te mets leurs musiques la conet secondes plus tard il te raccroche au nez nous ils nous poussent ce mes au finale rentre dans les galres financires alors quon des indemnits,0.9293827414512634,Negatif
1591,2019-05-23,Cergy,quand j ai lu les avis j ai flippet puis j suis allbha en fait super acceuil prise en charge rapide j ai eu tout les renseignements que je voulais au et avec le sourire en plus,0.9730440527200699,Positif
1592,2023-02-21,Cergy,tres bon acceuil,0.9108768999576569,Positif
1593,2019-05-23,Cergy,agence qui sert rien j tais dans l agence de conflans avant c est la nuit et le jour je vous recommande aller conflans,0.7720326781272888,Negatif
1594,2019-05-23,Cergy,toujours demander des papiers diffrentes selon la personne quon en face de nous,0.5219594687223434,Positif
1595,2019-05-23,Cergy,cest cherche un emploi,0.46618348360061646,Positif
1596,2020-05-22,Cergy,franchement nul,0.9936736822128296,Negatif
1597,2018-05-23,Cergy,agence incomptente,0.5789932310581207,Negatif
1598,2021-05-22,Cergy,excel,0.8800256848335266,Positif
1599,2019-05-23,Montreuil,btiment propre le personnel daccueil parus un peu froid larriv mais au moment de partir un peu moins les bureaux sont calmes et le lab plutt impressionnant quand ne connait pas mieux,0.7480318993330002,Positif
1600,2021-05-22,Montreuil,le tlphone affich correspond aux impts et absolument pas ple emploi ne surtout pas utiliser,0.9610727578401566,Negatif
1601,2020-05-22,Montreuil,peu despace de dtentesinon bien situ,0.49681299924850464,Neutre
1602,2019-05-23,Montreuil,il ne sagit pas dun tablissement ouvert au public,0.5453591346740723,Negatif
1603,2020-05-22,Montreuil,super quipe travaille au diapason j aime,0.9778911769390106,Positif
1604,2022-05-22,Montreuil,au service des demandeurs demploi,0.7717818915843964,Positif
1605,2023-04-22,Montreuil,cest la direction service informatique pas ouvert au public,0.7092792093753815,Negatif
1606,2022-05-22,Montreuil,amazing,0.6621055006980896,Positif
1607,2023-02-21,Rueil-Malmaison,dommage que lon ne puisse mettre mme sil au moins une personne qui semblait attentive mon dossier mais qui na pu le grer il semble que pour les autres nos situations soient prises par dessus la jambe jamais connu un service client aussi catastrophique oblig de tourner vers le mdiateur,0.8138181865215302,Negatif
1608,2023-05-01,Rueil-Malmaison,je suis rendu au ple emploi le aux alentours de h jai accueilli par un jeune homme laccueil qui su rpondre clairement mes interrogations jeune homme trs professionnel trs courtois merci,0.8881936073303223,Positif
1609,2023-02-21,Rueil-Malmaison,ple emploi est en charge de laccompagnement des demandeurs demploi dans leur recherche demploi et rpond aux besoins de recrutement des entreprises cest un mensonge dans cet endroit les personnes qui travaillent nous traitent comme des idiots les personnes qui travaillent ici nont aucune qualit humaine les personnes charges de donner des informations sont trs fermes grossires et arrogantesils sont presss pour aller fumer,0.9128360152244568,Negatif
1610,2023-05-01,Rueil-Malmaison,ces pauvres gens qui sont obligs dtre dans cette agence pleemploi toutes mes condolances ces personnes rip dommage de ne pouvoir donner un cette valuation,0.5005321949720383,Negatif
1611,2023-03-23,Rueil-Malmaison,une bande de bras casss qui savent pas annonc les personnes qui rdv plus h attendre pour quon dise que cest pas possible je suis trop en retard h ptn si je pouvais mettre je le ferais,0.9078720360994339,Negatif
1612,2022-11-23,Rueil-Malmaison,absolument pas pratique daccs quand na que les transports en communfaudrait srieusement songer sinstaller dans des bureaux plus accessibles plus proche de la gare par exemple,0.7792364358901978,Negatif
1613,2022-10-24,Rueil-Malmaison,nattendez pas de progresser professionnellement avec ple emploi ils vous prviendront au dernier moment qu ils ne vous aideront pas financer votre formation et n aurez aucune alternative honntement hyper dcevants peu professionnels ne leur confiez pas votre avenir,0.897594228386879,Negatif
1614,2023-04-22,Rueil-Malmaison,toujours bien reuun merci spcial mme caux qui beaucoup aider dans un moment difficile,0.9266091883182526,Positif
1615,2022-12-23,Rueil-Malmaison,franchement le monsieur qui tait aujourdhui ple emploi il est trop gentil en plus il rgle les problmes des gens je suis satisfaite,0.9639648199081421,Positif
1616,2022-11-23,Rueil-Malmaison,je suis pass ce matinils ont ferms sans avertissementsans afficheles porte ont ouverteespersonne nest lbas cest quoi ce service,0.9175135642290115,Negatif
1617,2022-05-22,Rueil-Malmaison,jai eu plusieurs changes tlphonique avec une jf qui est dastreinte ce jour le elle est efficace claire et oprationnelle nhsite pas vous rappeler pour mettre le dossier jour et est agrable merci de votre aide chre madame,0.7977143228054047,Positif
1618,2023-05-01,Rueil-Malmaison,injoignable par tlphone pas de rponse aux mails inutile,0.9577761963009834,Negatif
1619,2019-05-23,Rueil-Malmaison,le rendezvous fix de faon arbitraire h avantje suis arrive minutes en avance et jai reus minutes en retardune heure prsenter la cration et la mise jour du site internet de ple emploi bien sr je sais dj servir du site internetbilan malgr mon cv joint je dois remplir tous les champs du site de ple emploi car ple emploi et les recruteurs ne prennent pas le temps de regarder le cv il sarrtent au site de ple emploi,0.6521285474300385,Negatif
1620,2019-05-23,Rueil-Malmaison,jai agrablement surprise par la manire dont jai reue par le pole emploi rueil personnes laccueil trs sympathiques quant conseillre juste parfaite trs lcoute comptente jai ravie du rendezvous je ne pense pas avoir le droit de diffuser un nom sur un commentaire google mais si vous voulez son nom pour la gratifier de quelque manire que ce soit nhsitez pas contacter,0.948709636926651,Positif
1621,2022-08-25,Rueil-Malmaison,des incomptent merci au jeune handicape qui lui au moin sert quelque chose,0.5243562310934067,Negatif
1622,2019-05-23,Rueil-Malmaison,bonjour tout le monde daprs que jai vu les ple emploi dautres dpartements celle de rueilmalmaison dj laccueil ils font leur travail correctement et tout service personnel il laisse pas ton dossier traner trop moi je trouve qui sont cool,0.7093203365802765,Positif
1623,2021-05-22,Rueil-Malmaison,nul les incapables incomptents feignant ne voulant pas traiter les dossiers oblig de relancer plus de fois,0.9573019444942474,Negatif
1624,2023-01-22,Rueil-Malmaison,conseillre totalement incomptente,0.7213127464056015,Negatif
1625,2018-05-23,Rueil-Malmaison,personnel en stress total juge les personnes un peut rapidement,0.49477043747901917,Neutre
1626,2019-05-23,Rueil-Malmaison,lamabilit est en option chez eux,0.6598377823829651,Positif
1627,2018-05-23,Rueil-Malmaison,accueil nul et conseillers mal renseigns,0.9874119684100151,Negatif
1628,2023-05-08,Rueil-Malmaison,conseiller elle demand le titre de sjour sans savoir que la pologne est dans lunion europenne,0.44455598294734955,Negatif
1629,2021-05-22,Rueil-Malmaison,tricky entrance,0.6619836688041687,Positif
1630,2022-05-22,Boulogne-Billancourt,un accueil et une orientation impeccable je suis arrive lavance pour mon rdv et jai trouv les employs vraiment aimable professionnels polis accueillant et actif des personnes qui vous accompagne dans vos dmarches sur les ordinateurs conseillre tait vraiment au fait de situation et su morienter minformer et conseiller jai eu une trs bonne exprience au sein de cette agence,0.9671627581119537,Positif
1631,2022-05-22,Boulogne-Billancourt,inutiles cest juste un bel outil de manipulation des stats au service des politiquesaucune formation possibleje ne compte que sur mon mme pour rebondir,0.9328784346580505,Negatif
1632,2018-05-23,Boulogne-Billancourt,annulations de rendez vous successives et mme pas une excuse en revanche si rate un rdv est radi certains conseillers bien mieux que dautres bref ne comptez pas sur pole emploi pour trouver du travail la recherche personnelle est bien plus porteuse honteux que ce service pay avec nos impts soit si inefficace et tout le monde sen moque,0.9617602229118347,Negatif
1633,2018-05-23,Boulogne-Billancourt,espace rduit manque de place dtente pour mieux tre accompagn vers une issue dans sa recherche demploi et autres services lis aux dmarchesles accompagnateurs sur les machines ordinateurs sont trs souvent dbords et trop souvent de bug informatique,0.5146551132202148,Neutre
1634,2018-05-23,Boulogne-Billancourt,malgrs beaucoup de demandeurs les agents se mets en pour nous guiderdommage qu ils n est pas assez de moyens pour eux comme pour nousje suppose qu ils ont des directives,0.3907671272754669,Negatif
1635,2018-05-23,Boulogne-Billancourt,lorsquon besoin deux personne au tlphone vous dit de vous dplacer une sur place vous suggre dcrire un mail votre conseillre aujourdhui encore jattends rponse,0.7015782594680786,Positif
1636,2022-10-24,Boulogne-Billancourt,inscription aux services sans laccord du demandeur,0.5288917124271393,Negatif
1637,2022-05-22,Boulogne-Billancourt,mauvais agnce pas possiblit de changer conseiller et sinscrire aux formations,0.8993690609931946,Negatif
1638,2018-05-23,Boulogne-Billancourt,cest ple emploi rasil manque une fontaine deau et wcsa serait gnial davoir des gteaux et des cookies la team est trs correcte merci ple emploi,0.6045874059200287,Positif
1639,2020-05-22,Boulogne-Billancourt,inutiles cest juste hallucinant leur fonctionnement un bel outil de manipulation des stats au service des politiques,0.4879595935344696,Negatif
1640,2022-05-22,Boulogne-Billancourt,conseillre au jai rapidement trouv un emploi,0.7810313403606415,Positif
1641,2021-05-22,Boulogne-Billancourt,accueil agrable l coute ils sont serviables trs bon comme ressenti,0.8410713076591492,Positif
1642,2018-05-23,Boulogne-Billancourt,plus de min dattente un rdv,0.7241650074720383,Positif
1643,2019-05-23,Boulogne-Billancourt,jai tomb sur une conseillre trs comprhensible et lcoute,0.9144429266452789,Positif
1644,2020-05-22,Boulogne-Billancourt,si vous navez besoin de rien cest trs bien,0.8254851400852203,Positif
1645,2018-05-23,Boulogne-Billancourt,au fond de la cour nanmoins les bureaux sont modernes et neufs,0.6760722994804382,Positif
1646,2018-05-23,Boulogne-Billancourt,toujour le mme bordel fait pas attendre autre,0.8686481714248657,Negatif
1647,2018-05-23,Boulogne-Billancourt,peut importe les villes cest pareil au mme,0.4923080950975418,Negatif
1648,2018-05-23,Boulogne-Billancourt,ple emploi vous connaissez jai pas besoin dexpliquer,0.6670279204845428,Positif
1649,2019-05-23,Boulogne-Billancourt,glauque,0.6297808885574341,Negatif
1650,2018-05-23,Boulogne-Billancourt,nul,0.9806650876998901,Negatif
1651,2020-05-22,Boulogne-Billancourt,espace rduit,0.40876537561416626,Neutre
1652,2021-05-22,Boulogne-Billancourt,j chercher des travail,0.5638763010501862,Positif
1653,2022-10-24,Boulogne-Billancourt,hospitality serve people need help,0.7822842001914978,Positif
1654,2018-05-23,Boulogne-Billancourt,good,0.7598509788513184,Positif
